{
  "schema_version": 1,
  "base_tag": "v29.4",
  "base_commit": "sha1:3fc0865963a38b871e9f7d94e6151c4953563516",
  "target_commit": "sha1:cbc88cff9b35b95a549c0313e424e13093fcd6a1",
  "target_tree": "sha1:39a5e30207a09962e78ae81c24cc65b1e478ef90",
  "aggregate_diff_digest": "sha256:1d90add7572488689c9a8a902c19103cdc8db3967c33b97acb95bb354328a81d",
  "manifest_owned_diff_digest": "sha256:1d90add7572488689c9a8a902c19103cdc8db3967c33b97acb95bb354328a81d",
  "commit_map": [
    {
      "commit": "sha1:a933bc95a76e2632a177c11bad28268a14b2c752",
      "adaptation_ids": ["roots-knots-build-ci-build-or-release"],
      "provenance": [{"commit": "sha1:dd3050a6101a071a0b642ba71ab7eaddbe4cf5b8", "confidence": "reviewed", "project": "bitcoin-roots"}]
    },
    {
      "commit": "sha1:5394b97684a6935719b40339327096210ca6a702",
      "adaptation_ids": ["roots-knots-common-maintenance"],
      "provenance": [{"commit": "sha1:dd3050a6101a071a0b642ba71ab7eaddbe4cf5b8", "confidence": "reviewed", "project": "bitcoin-roots"}]
    },
    {
      "commit": "sha1:aef68562ceb8e58c2a9447d83e77929923da7108",
      "adaptation_ids": ["roots-knots-consensus-validation-consensus-adjacent"],
      "provenance": [{"commit": "sha1:dd3050a6101a071a0b642ba71ab7eaddbe4cf5b8", "confidence": "reviewed", "project": "bitcoin-roots"}]
    },
    {
      "commit": "sha1:01bd9178082be456ffc89f13b8d57fd3f574ad8c",
      "adaptation_ids": ["roots-knots-documentation-documentation"],
      "provenance": [{"commit": "sha1:dd3050a6101a071a0b642ba71ab7eaddbe4cf5b8", "confidence": "reviewed", "project": "bitcoin-roots"}]
    },
    {
      "commit": "sha1:43e32077864794dc10cdef25eba2204e8fff365b",
      "adaptation_ids": ["roots-knots-gui-branding-ui"],
      "provenance": [{"commit": "sha1:dd3050a6101a071a0b642ba71ab7eaddbe4cf5b8", "confidence": "reviewed", "project": "bitcoin-roots"}]
    },
    {
      "commit": "sha1:7d8f1765ca7f557a901965dfef8564ee04bde181",
      "adaptation_ids": ["roots-knots-p2p-networking"],
      "provenance": [{"commit": "sha1:dd3050a6101a071a0b642ba71ab7eaddbe4cf5b8", "confidence": "reviewed", "project": "bitcoin-roots"}]
    },
    {
      "commit": "sha1:c2344aefc8e8ed7e39761592d5ad3182ae21c01c",
      "adaptation_ids": ["roots-knots-policy-local-policy"],
      "provenance": [{"commit": "sha1:dd3050a6101a071a0b642ba71ab7eaddbe4cf5b8", "confidence": "reviewed", "project": "bitcoin-roots"}]
    },
    {
      "commit": "sha1:4b63cf7a876b9315fd956863cf9ffdaa1a4a778c",
      "adaptation_ids": ["roots-knots-tests-test-coverage"],
      "provenance": [{"commit": "sha1:dd3050a6101a071a0b642ba71ab7eaddbe4cf5b8", "confidence": "reviewed", "project": "bitcoin-roots"}]
    },
    {
      "commit": "sha1:faa7c0ea573add0a99dc69f1d3ce4b84a7ca9aed",
      "adaptation_ids": ["roots-knots-wallet-wallet"],
      "provenance": [{"commit": "sha1:dd3050a6101a071a0b642ba71ab7eaddbe4cf5b8", "confidence": "reviewed", "project": "bitcoin-roots"}]
    },
    {
      "commit": "sha1:78346474b6112dec9dd609357df3966d454dfdc7",
      "adaptation_ids": ["roots-roots-build-ci-build-or-release"],
      "provenance": [{"commit": "sha1:dd3050a6101a071a0b642ba71ab7eaddbe4cf5b8", "confidence": "reviewed", "project": "bitcoin-roots"}]
    },
    {
      "commit": "sha1:8ceef066cf1d7d754188750d99e306932020e988",
      "adaptation_ids": ["roots-roots-common-maintenance"],
      "provenance": [{"commit": "sha1:dd3050a6101a071a0b642ba71ab7eaddbe4cf5b8", "confidence": "reviewed", "project": "bitcoin-roots"}]
    },
    {
      "commit": "sha1:bf9e2bd9eb41af2b9cdf7d26788f7ed1814ce464",
      "adaptation_ids": ["roots-roots-consensus-validation-consensus-adjacent"],
      "provenance": [{"commit": "sha1:dd3050a6101a071a0b642ba71ab7eaddbe4cf5b8", "confidence": "reviewed", "project": "bitcoin-roots"}]
    },
    {
      "commit": "sha1:dbdd05aad92d7a219a8559dcfaa4a93fce373f7a",
      "adaptation_ids": ["roots-roots-documentation-documentation"],
      "provenance": [{"commit": "sha1:dd3050a6101a071a0b642ba71ab7eaddbe4cf5b8", "confidence": "reviewed", "project": "bitcoin-roots"}]
    },
    {
      "commit": "sha1:9e99e209d8731092e059f32f7f81f7846c942d90",
      "adaptation_ids": ["roots-roots-gui-branding-ui"],
      "provenance": [{"commit": "sha1:dd3050a6101a071a0b642ba71ab7eaddbe4cf5b8", "confidence": "reviewed", "project": "bitcoin-roots"}]
    },
    {
      "commit": "sha1:4e8610eae707863ea37fc682a880067f6a3cfac5",
      "adaptation_ids": ["roots-roots-release-generated-output"],
      "provenance": [{"commit": "sha1:dd3050a6101a071a0b642ba71ab7eaddbe4cf5b8", "confidence": "reviewed", "project": "bitcoin-roots"}]
    },
    {
      "commit": "sha1:cbc88cff9b35b95a549c0313e424e13093fcd6a1",
      "adaptation_ids": ["roots-roots-tests-test-coverage"],
      "provenance": [{"commit": "sha1:dd3050a6101a071a0b642ba71ab7eaddbe4cf5b8", "confidence": "reviewed", "project": "bitcoin-roots"}]
    }
  ]
}
